<?xml version="1.0" ?>

<!-- Reference

http://arianne.cvs.sf.net/viewvc/arianne/stendhal/data/conf/creatures/elf.xml?view=markup

-->

<entities xmlns:xsi="http://www.w3.org/2001/XMLSchema-instance" xsi:noNamespaceSchemaLocation="entities.xsd">
    <entity id="0" name="Sewer Rat">
        <class style="short range" damageType="melee" tileId="SewerRat.png" />
        
        <description>A filthy rat that has crawled out from an unknown location to ruin your day.</description>
        <experience>12</experience>
        <faction>0</faction>
        <!-- <corpse description="Rotting away..." /> -->

        <attributes>
            <health value="1.3" />
            <strength value="0.75" />
            <accuracy value="1" />
            <defense value="0" />
            <evasion value="0" />
            <fireMagicBonus value="0" />
            <frostMagicBonus value="0" />
            <holyMagicBonus value="0" />
            <chaosMagicBonus value="0" />
            <faithMagicBonus value="0" />
        </attributes>

        <lootTable>
            <drop quantity="[1,1]" probability="100.0">
                <item type="gold" id="0" quantity="[3,15]" probability="100.0" />
            </drop>
            
            <drop quantity="[0,2]" probability="36.0">
                <item type="potion" id="7" level="1" quantity="[1,1]" probability="2.0" />
                <item type="scroll" id="8" level="0" quantity="[1,1]" probability="3.0" />
                <item type="food" id="9" level="1" quantity="[1,1]" probability="15.0" />
                <item type="projectile" id="10" level="0" quantity="[1,15]" probability="13.4" />
            </drop>

            <drop quantity="[0,1]" probability="12.0">
                <item type="weapon" id="1" level="1" quantity="[1,1]" probability="16.67" />
                <item type="weapon" id="2" level="1" quantity="[1,1]" probability="8.0" />
                <item type="weapon" id="3" level="1.3" quantity="[1,1]" probability="0.1" />
                <item type="armor" id="4" level="1" quantity="[1,1]" probability="16.67" />
                <item type="armor" id="5" level="1" quantity="[1,1]" probability="8.0" />
                <item type="armor" id="6" level="1" quantity="[1,1]" probability="8.0" />
            </drop>
        </lootTable>
    </entity>
</entities>